{
  "$schema": "http://json-schema.org/draft-07/schema#",
  "$id": "https://jtk25.my.id/schemas/events.json",
  "title": "Events",
  "description": "Daftar acara/events untuk mahasiswa JTK25",
  "type": "object",
  "required": ["schema", "semester", "updatedAt", "data"],
  "properties": {
    "schema": {
      "type": "integer",
      "const": 2
    },
    "semester": {
      "type": "string",
      "pattern": "^\\d{4}/\\d{4}-(GANJIL|GENAP)$"
    },
    "updatedAt": {
      "type": "string",
      "format": "date-time"
    },
    "data": {
      "type": "array",
      "items": {
        "$ref": "#/$defs/Event"
      }
    }
  },
  "additionalProperties": false,
  "$defs": {
    "Event": {
      "type": "object",
      "required": ["id", "title", "date", "endDate"],
      "properties": {
        "id": {
          "type": "string",
          "description": "Unique identifier"
        },
        "title": {
          "type": "string",
          "minLength": 1,
          "description": "Event title"
        },
        "description": {
          "type": "string",
          "description": "Event description"
        },
        "date": {
          "type": "string",
          "format": "date-time",
          "description": "Start date/time ISO 8601"
        },
        "endDate": {
          "type": "string",
          "format": "date-time",
          "description": "End date/time ISO 8601"
        },
        "location": {
          "type": "string",
          "description": "Event location"
        },
        "category": {
          "type": "string",
          "description": "Event category"
        }
      },
      "additionalProperties": false
    }
  }
}
